University,Motto,Language,Translation,text,country
Sant'Anna School of Advanced Studies,Excellentiam ut disciplinam / L'eccellenza come disciplina,Latin/Italian,Committed to excellence,Committed to excellence,Italy
University of Bologna,Alma mater studiorum,Latin,Nourishing mother of the studies,Nourishing mother of the studies,Italy
University of Padua,Universa Universis Patavina Libertas,Latin,"Liberty of Padua, universally and for all","Liberty of Padua, universally and for all",Italy
University of Pisa,In Supremae Dignitatis,Latin,In the highest dignity,In the highest dignity,Italy
University of Venice (Ca' Foscari),Venetiarum universitas in domo Foscari,Latin,University of the Venices in Foscari's house,University of the Venices in Foscari's house,Italy
University of Naples (Federico II),Ad scientiarum haustum et seminarium doctrinarum,Latin,A seminary for those drawn to fields of knowledge and doctrine.,A seminary for those drawn to fields of knowledge and doctrine.,Italy
Keio University,Calamus gladio fortior[103],Latin,The pen is mightier than the sword[103],The pen is mightier than the sword[103],Japan
Waseda University,学問の独立 (Gakumon no Dokuritsu)[104],Japanese,Independence of scholarship[104],Independence of scholarship[104],Japan
Kwansei Gakuin University,奉仕のための練達 (Hōshi no Tame no Rentatsu)[105],Japanese,Mastery for Service[105],Mastery for Service[105],Japan
Rikkyo University,Pro Deo et Patria[106],Latin,For God and Country[106],For God and Country[106],Japan
Chung-Ang University (CAU),의에 죽고 참에 살자 (Euihe jookgo chame salja),Korean,"Live in Truth, Live for Justice","Live in Truth, Live for Justice",South_Korea
Ewha Womans University,"진, 선, 미 (Jin, Seon, Mi)",Korean,"Truth, Goodness, Beauty","Truth, Goodness, Beauty",South_Korea
Gyeongsang National University,개척 (Gaechok),Korean,Pioneer.,Pioneer.,South_Korea
Hankuk University of Foreign Studies (HUFS),외대로 오면 세계를 만난다 (Wedero omyeon Segyerul man-nanda),Korean,"Come to HUFS, Meet the World","Come to HUFS, Meet the World",South_Korea
Hanyang University,사랑의 실천 (Sarang-eui shilcheon),Korean,Love in Truth and in Deed.,Love in Truth and in Deed.,South_Korea
Hongik University,Pro Hominum Beneficio,Latin,Act of kindness for the human kind,Act of kindness for the human kind,South_Korea
Konkuk University,"성, 신, 의 (Seong, Shin, Ui)",Korean,"Sincerity, Fidelity, and Righteousness","Sincerity, Fidelity, and Righteousness",South_Korea
Korea Advanced Institute of Science and Technology (KAIST),"Education for the world, research for the future",English,,"Education for the world, research for the future",South_Korea
Korea National University of Education (KNUE),"사랑, 신뢰, 인내 (Sarang, Silloe, Innae)",Korean,"Love, Confidence, and Patience","Love, Confidence, and Patience",South_Korea
Korea University,"자유, 정의, 진리 (Jayu, Jungeu, Jinli)",Korean,"Freedom, Justice, Truth","Freedom, Justice, Truth",South_Korea
Pohang University of Science and Technology (POSTECH),"성실, 창의, 진취 (Sungsil, Changeui, Jinchi)",Korean,"Integrity, Creativity, and Aspiration","Integrity, Creativity, and Aspiration",South_Korea
Seoul National University (SNU),Veritas lux mea,Latin,Truth is my light.,Truth is my light.,South_Korea
Sogang University,Obedire Veritati,Latin,Obey the Truth.,Obey the Truth.,South_Korea
Sookmyung Women's University,"정숙, 현명, 정대 (Jeongsook, Hyunmyung, Jeongdae)",Korean,"Modesty, Wisdom, and Justice","Modesty, Wisdom, and Justice",South_Korea
Soongsil University,진리와 봉사 (Jinliwa Bongsa),Korean,Truth and Service.,Truth and Service.,South_Korea
Sungkyunkwan University,수기치인 (Su Gi Chi In),Korean,Pursue Truth and Embody Social Justice [the Analects of Confucius],Pursue Truth and Embody Social Justice [the Analects of Confucius],South_Korea
Yonsei University,진리가 너희를 자유롭게 하리라. (Jinli-ga neohui-rul jayuropke-harira),Korean,Truth will set you free. [John 8:32],Truth will set you free. [John 8:32],South_Korea
University of Latvia,Scientiae et patriae [2],Latin,For science and fatherland,For science and fatherland,Latvia
Daugavpils University,Scientia Vinces [3],Latin,Through knowledge you win,Through knowledge you win,Latvia
American University of Beirut,That they may have life and have it more abundantly,English,[John 10:10],That they may have life and have it more abundantly,Lebanon
University of Macau,仁義禮知信[107],Classical Chinese,"Humanity, integrity, propriety, wisdom and sincerity[108]","Humanity, integrity, propriety, wisdom and sincerity[108]",Macau
University of Antananarivo,Izay adala no toa an-drainy,Malagasy,Foolish is he who seeks only to emulate his father,Foolish is he who seeks only to emulate his father,Madagascar
International Islamic University Malaysia,Taman Ilmu dan Budi,Malay,Garden of Knowledge and Virtue,Garden of Knowledge and Virtue,Malaysia
Multimedia University,"Inquire, Inspire and Innovate[109][110]",English,,"Inquire, Inspire and Innovate[109][110]",Malaysia
National University of Malaysia,"Mengilham harapan, mencipta masa depan[111]",Malay,"Inspiring futures, nurturing possibilities[112]","Inspiring futures, nurturing possibilities[112]",Malaysia
Tun Hussein Onn University of Malaysia,Dengan Hikmah Kita Meneroka[113],Malay,"With Wisdom, We Explore[114]","With Wisdom, We Explore[114]",Malaysia
Sultan Zainal Abidin University,Ilmu Demi Faedah Insan[115],Malay,Knowledge for the Benefit of Humanity[115],Knowledge for the Benefit of Humanity[115],Malaysia
Universiti Malaya,Ilmu Punca Kemajuan,Malay,Knowledge is the Key to Success,Knowledge is the Key to Success,Malaysia
Universiti Malaysia Sarawak,Bersifat Sezaman dan Berpandangan Jauh,Malay,Contemporary and Forward Looking,Contemporary and Forward Looking,Malaysia
Universiti Putra Malaysia,Berilmu Berbakti,Malay,With Knowledge We Serve,With Knowledge We Serve,Malaysia
Universiti Sains Malaysia,Kami Memimpin,Malay,We Lead,We Lead,Malaysia
Universiti Teknologi Malaysia,Kerana Tuhan Untuk Manusia[116],Malay,In the Name of God for Mankind[116],In the Name of God for Mankind[116],Malaysia
Universiti Teknologi Mara,"Usaha, Taqwa, Mulia[117]",Malay,"Endeavour, Religious, Dignified[118]","Endeavour, Religious, Dignified[118]",Malaysia
Universiti Utara Malaysia,"Ilmu, Budi, Bakti[119]",Malay,"Scholarship, Virtue, Service[120]","Scholarship, Virtue, Service[120]",Malaysia
Universidad de las Américas Puebla,"Sapientia, Pax, Fraternitas",Latin,"Wisdom, Peace, Brotherhood","Wisdom, Peace, Brotherhood",Mexico
Universidad Anahuac - UAX,Vince in bono malum,Latin,Conquer evil with good.,Conquer evil with good.,Mexico
Universidad Autónoma de la Ciudad de México,Nada Humano me es Ajeno,Spanish,Nothing human is alien to me,Nothing human is alien to me,Mexico
Universidad Tecnologica de Mexico - UNITEC,Ciencia y Técnica con Humanismo,Spanish,Science and technics with humanism,Science and technics with humanism,Mexico
Autonomous University of Campeche,Del Enigma sin Albas a Triángulos de Luz,Spanish,From Mystery Without a Dawn to Triangles of Light,From Mystery Without a Dawn to Triangles of Light,Mexico
Universidad de Monterrey,Homo Hominis in Ministerio Perficitur,Latin,Man is perfected through the service of man,Man is perfected through the service of man,Mexico
Autonomous University of Nuevo Leon,Alere Flammam Veritatis,Latin,To feed the flame of truth.,To feed the flame of truth.,Mexico
Autonomous University of Baja California,Por la realización plena del hombre,Spanish,For man's fulfillment,For man's fulfillment,Mexico
Autonomous University of Chihuahua,"Luchar para Lograr, Lograr para Dar",Spanish,"Fight to Achieve, Achieve to Give","Fight to Achieve, Achieve to Give",Mexico
Instituto Tecnológico Autónomo de México - ITAM,Los mejores profesores para los mejores estudiantes,Spanish,The best teachers for the best students.,The best teachers for the best students.,Mexico
Instituto Politécnico Nacional - IPN,La técnica al servicio de la patria,Spanish,Technique at the service of the fatherland,Technique at the service of the fatherland,Mexico
Universidad Iberoamericana,La Verdad Nos Hará Libres,Spanish,The truth will set us free. [John 8:32],The truth will set us free. [John 8:32],Mexico
Universidad Juarez Autonoma de Tabasco,"Estudio en la Duda, Acción en la Fe",Spanish,"Study in doubtful things, action in the Faith.","Study in doubtful things, action in the Faith.",Mexico
University of Guadalajara,Piensa y Trabaja,Spanish,Think and Work,Think and Work,Mexico
Sonora Institute of Technology,Educar para trascender,Spanish,Educate to transcend,Educate to transcend,Mexico
Universidad de Sonora,El saber de mis hijos hará mi grandeza,Spanish,The knowledge of my children will be my greatness,The knowledge of my children will be my greatness,Mexico
National Autonomous University of Mexico,Por mi raza hablará el espíritu,Spanish,For my people the Spirit will speak,For my people the Spirit will speak,Mexico
National Polytechnic Institute,La técnica al servicio de la patria,Spanish,The technique to the service of the fatherland,The technique to the service of the fatherland,Mexico
Universidad Veracruzana,"Lis de Veracruz, Arte, Ciencia, Luz",Spanish,"Lily of Veracruz, Art, Science, Light","Lily of Veracruz, Art, Science, Light",Mexico
Universidad Autónoma de Yucatán,"Luz, Ciencia, y Verdad",Spanish,"Light, Science, and Truth","Light, Science, and Truth",Mexico
Universidad Autonoma Agraria Antonio Narro,Alma Terra Mater,Latin,Kindly Mother Earth,Kindly Mother Earth,Mexico
Ion Creangă Pedagogical State University,Disce ut doceas,Latin,Learn in order to teach,Learn in order to teach,Moldova
Moldova State University,Vitae discimus,Latin,For life we learn,For life we learn,Moldova
Nicolae Testemițanu State University of Medicine and Pharmacy,Lucendo allis ego ipse ardeo!,Latin,"While I burn, I give light to others!","While I burn, I give light to others!",Moldova
Delft University of Technology,Challenge the Future,English,,Challenge the Future,The_Netherlands
Eindhoven University of Technology,Mens Agitat Molem,Latin,The mind moves matter,The mind moves matter,The_Netherlands
Erasmus University,Main port of knowledge,English,,Main port of knowledge,The_Netherlands
Groningen University,Verbum domini lucerna pedibus nostris,Latin,The word of the Lord is a light for our feet,The word of the Lord is a light for our feet,The_Netherlands
Kampen Theological University,In lumine tuo videmus lumen,Latin,In Your Light we see the light,In Your Light we see the light,The_Netherlands
Leiden University,Praesidium Libertatis,Latin,Bastion of Freedom,Bastion of Freedom,The_Netherlands
Maastricht University,Leading in Learning,English,,Leading in Learning,The_Netherlands
Nyenrode Business University,The Spirit of Enterprise,English,,The Spirit of Enterprise,The_Netherlands
Radboud University Nijmegen,In Dei Nomine Feliciter,Latin,May we proceed with happiness in God's name,May we proceed with happiness in God's name,The_Netherlands
Tilburg University,Understanding Society,English,,Understanding Society,The_Netherlands
University of Twente,"High Tech, Human Touch",English,,"High Tech, Human Touch",The_Netherlands
University of Amsterdam,(no official motto),,,,The_Netherlands
Utrecht University,Sol Iustitiae Illustra Nos,Latin,"Sun of Justice, Enlighten Us","Sun of Justice, Enlighten Us",The_Netherlands
Free University Amsterdam,Auxilium nostrum in nomine Domini,Latin,Our help is in the name of the Lord,Our help is in the name of the Lord,The_Netherlands
Wageningen University,For quality of life,English,,For quality of life,The_Netherlands
Lincoln University,Scientia et industria cum probitate,Latin,Science and industry with integrity,Science and industry with integrity,New_Zealand
Massey University,Floreat scientia,Latin,Let knowledge flourish,Let knowledge flourish,New_Zealand
University of Auckland,Ingenio et Labore,Latin,By natural ability and hard work,By natural ability and hard work,New_Zealand
University of Canterbury,Ergo tua rura manebunt,Latin,"Therefore, your fields will remain (yours)","Therefore, your fields will remain (yours)",New_Zealand
University of Otago,Sapere aude,Latin,Dare to be wise,Dare to be wise,New_Zealand
University of Waikato,Ko te tangata,Māori,For the people,For the people,New_Zealand
Victoria University of Wellington,Sapientia magis auro desideranda,Latin,Wisdom is desired more than gold,Wisdom is desired more than gold,New_Zealand
"International Islamic University, Islamabad",وفوق كل ذي علم عليم,Arabic (quote from Quran),And above every possessor of knowledge is someone more knowledgeable,And above every possessor of knowledge is someone more knowledgeable,Pakistan
"Al-Islah Islamic Education System, Sadiqabad, RYK",إن أريد إلا الإصلاح ما استطعت,Arabic (quote from Quran),I only seek advancement to the best of my abilities,I only seek advancement to the best of my abilities,Pakistan
"University of Agriculture, Faisalabad","Et ex omnibus virtutibus Universitatis brings, inter incapability",Latin,"The University brings out all abilities, including incapability","The University brings out all abilities, including incapability",Pakistan
University of Karachi,رَبِّ زدْنيِ علماً,Arabic,O my Lord! Advance me in Knowledge,O my Lord! Advance me in Knowledge,Pakistan
"Institute of Management Sciences, Lahore",Where Aims Become Achievement,English,,Where Aims Become Achievement,Pakistan
Institute of Business Administration (Karachi),Leadership and Ideas for Tomorrow,English,,Leadership and Ideas for Tomorrow,Pakistan
COMSATS Institute of Information Technology,We Aim to Inspire,English,,We Aim to Inspire,Pakistan
PISTON COLLEGE S.I.T.E. KARACHI,LIFELONG LEARNING,English,,LIFELONG LEARNING,Pakistan
Catholic University of Asunción,In Principio Erat Verbum - Genuit Nos Verbo Veritatis,Latin,"In the Beginning was the Word - He Has Begotten Us by the Word of Truth [John 1:1], [James 1:18]","In the Beginning was the Word - He Has Begotten Us by the Word of Truth [John 1:1], [James 1:18]",Paraguay
National University of Asunción,Vitam Impendere Vero,Latin,"To stake one's life on what is true. - Juvenal, Satires, IV, 91.","To stake one's life on what is true. - Juvenal, Satires, IV, 91.",Paraguay
Pontifical Catholic University of Perú,Et Lux in Tenebris Lucet,Latin,And the Light Shone in the Dark,And the Light Shone in the Dark,Per.C3.BA
Universidad de Lima,Scientia et Praxis,Latin,Science and Practice,Science and Practice,Per.C3.BA
Adamson University,My Faith in God Almighty,English,,My Faith in God Almighty,Perú
Adventist University of the Philippines,On Ever Onward,English,,On Ever Onward,Perú
Arellano University,Pro Deo et Patria,Latin,For God and Country,For God and Country,Perú
Ateneo de Cagayan - Xavier University,Veritas Liberabit Vos,Latin,The Truth Shall Set You Free,The Truth Shall Set You Free,Perú
Ateneo de Davao University,Fortes in Fide,Latin,Strong in Faith,Strong in Faith,Perú
Ateneo de Manila University,Lux in Domino,Latin,Light in the Lord,Light in the Lord,Perú
Ateneo de Naga University,Primum Regnum Dei,Latin,"First, The Kingdom of God","First, The Kingdom of God",Perú
Ateneo de Zamboanga University,Pro Deo et Patria,Latin,For God and Country,For God and Country,Perú
Baliuag University,"Patria, Scientia et Virtus",Latin,"Country, Science and Virtue","Country, Science and Virtue",Perú
Central Philippine University,Scientia et Fides,Latin,Knowledge and Faith,Knowledge and Faith,Perú
Centro Escolar University,Ciencia y Virtud,Spanish,Science and Virtue,Science and Virtue,Perú
Colegio de San Juan de Letran,"Deus, Patria, Letran",Latin,"God, Country, Letran","God, Country, Letran",Perú
De La Salle University,"Religio, Mores, Cultura",Latin,"Religion, Morals, Culture","Religion, Morals, Culture",Perú
Far Eastern University,"Fortitude, Excellence, Uprightness",English,,"Fortitude, Excellence, Uprightness",Perú
Holy Angel University,Laus Deo Semper,Latin,Praise God Always,Praise God Always,Perú
La Fortuna College,"Veritas et honor, vis in perita",Latin,"Truth and honor, strength in skill","Truth and honor, strength in skill",Perú
Laguna State Polytechnic University,"Agriculture, Fisheries, Technology",English,NA,"Agriculture, Fisheries, Technology",Perú
Loyola College of Culion,Fortes in Fide,Latin,Strong in Faith,Strong in Faith,Perú
Lyceum of the Philippines University,"Veritas et Fortitudo, Pro Deo et Patria",Latin,"Truth and Courage, For God and Country","Truth and Courage, For God and Country",Perú
Malayan Colleges Laguna,Excellence and Virtue,English,NA,Excellence and Virtue,Perú
Manuel S. Enverga University Foundation,Pro Deo et Patria,Latin,For God and Country,For God and Country,Perú
Misamis University,Educating for the Future,English,,Educating for the Future,Perú
Mountain View College,Shine On Til Jesus Comes,English,NA,Shine On Til Jesus Comes,Perú
New Era University,Godliness is the Foundation of Knowledge.,English,NA,Godliness is the Foundation of Knowledge.,Perú
Our Lady of Fatima University,Veritas et Misericordia,Latin,For Truth and Compassion,For Truth and Compassion,Perú
Pamantasan ng Cabuyao,"Kapayapaan, Kaunlaran, Paglilingkod",Filipino,"Peace, Prosperity, Service","Peace, Prosperity, Service",Perú
Pamantasan ng Lungsod ng Maynila,"Karunungan, Kaunlaran, Kadakilaan",Filipino,"Wisdom, Prosperity, Greatness","Wisdom, Prosperity, Greatness",Perú
Philippine Normal University,"Truth, Excellence, Service",English,NA,"Truth, Excellence, Service",Perú
Polytechnic University of the Philippines,Tanglaw ng Bayan,Filipino,Light of the Nation,Light of the Nation,Perú
San Beda College,"Fides, Scientia, Virtus",Latin,"Faith, Knowledge, Virtue","Faith, Knowledge, Virtue",Perú
Saint Louis University,Sapientia Aedificat,Latin,Wisdom Builds,Wisdom Builds,Perú
Saint Mary's University,Sapientia A Deo,Latin,Wisdom from God,Wisdom from God,Perú
Saint Paul University System,"Caritas, Veritas, Scientia",Latin,"Love, Truth and Knowledge","Love, Truth and Knowledge",Perú
Silliman University,"Via, Veritas, Vita",Latin,"The Way, The Truth, The Life","The Way, The Truth, The Life",Perú
Trinity University of Asia,Pro Deo et Patria,Latin,For God and Country,For God and Country,Perú
University of Asia and the Pacific,Unitas,Latin,Unity,Unity,Perú
University of the Assumption,"Scientia, Virtus, et Communitas",Latin,"Knowledge, Virtue, Community Service","Knowledge, Virtue, Community Service",Perú
University of the East Ramon Magsaysay Memorial Medical Center,Pro Deo Et Patria,Latin,For God and Country,For God and Country,Perú
University of Perpetual Help System,Character Building is Nation Building,English,,Character Building is Nation Building,Perú
University of the Philippines (System),Honor and Excellence,English,,Honor and Excellence,Perú
University of San Agustin,Virtus et Scientia,Latin,Virtue and Science,Virtue and Science,Perú
University of San Carlos,"Scientia, Virtus, Devotio",Latin,"Knowledge, Virtues and Devotion","Knowledge, Virtues and Devotion",Perú
University of San Jose – Recoletos,Caritas et Scientia,Latin,Love and Knowledge,Love and Knowledge,Perú
University of Santo Tomas,Veritas in Caritate,Latin,Truth in Charity,Truth in Charity,Perú
West Visayas State University,"Service, Harmony, Excellence",English,,"Service, Harmony, Excellence",Perú
University of Łódź,Veritas et Libertas,Latin,Truth and Liberty,Truth and Liberty,Philippines
Jagiellonian University,Plus ratio quam vis,Latin,Let reason prevail over force (lit. More reason than for,Let reason prevail over force (lit. More reason than for,Philippines
AGH University of Science and Technology,"Labore creata, labori et scientiae servio",Latin,"Created in labour, I serve labour and science","Created in labour, I serve labour and science",Philippines
John Paul II Catholic University of Lublin,Deo et Patriae,Latin,To God and the Fatherland,To God and the Fatherland,Philippines
University of Lisbon[4],Ad Lucem,Latin,To the Light,To the Light,Poland
Portuguese Open University[5],Ad Astra,Latin,To the Stars,To the Stars,Poland
New University of Lisbon[6],Omnis Civitas Contra Se Divisa Non Stabit,Latin,All the city divided against itself will not remain,All the city divided against itself will not remain,Poland
Lusíada University[7],Sol Lucet Omnibus,Latin,The sun shines over everyone,The sun shines over everyone,Poland
University of Évora[8],Honesto Estudo com Longa Experiência Misturado,Portuguese,Honest Study mixed with Long Experience,Honest Study mixed with Long Experience,Poland
Catholic University of Portugal[9],Veritati,Latin,Truth,Truth,Poland
University of Aveiro[10],"Theoria, Poiesis, Praxis",Greek,"Theory, Reflection, Action","Theory, Reflection, Action",Poland
Lusophone University of Humanities and Technologies[11],Humani nihil alienum,Latin,Nothing human is strange to me,Nothing human is strange to me,Poland
University of Porto[12][permanent dead link],Virtus Unita Fortius Agit,Latin,The united virtue is the strongest,The united virtue is the strongest,Poland
University of Beira Interior[13],Scientia et Labore Altiora Petimus,Latin,Science and Work aim higher things,Science and Work aim higher things,Poland
University of Trás-os-Montes and Upper Douro[14],Scientia et labore omnia adipiscere,Latin,Science and Work to obtain all,Science and Work to obtain all,Poland
Alexandru Ioan Cuza University,Per libertatem ad veritatem,Latin,Through freedom to truth,Through freedom to truth,Portugal
Babeș-Bolyai University,Traditio nostra unacum Europae virtutibus splendet,Latin,Our tradition glows together with the virtues of Europe,Our tradition glows together with the virtues of Europe,Portugal
Gheorghe Asachi Technical University of Iași,Ipsa scientia potestas est,Latin,Knowledge itself is power,Knowledge itself is power,Portugal
Polytechnic University of Timișoara,"""Nu zidurile fac o școală, ci spiritul care domnește într’însa""",Romanian,"""It's not the walls that make a school, but the spirit living inside""","""It's not the walls that make a school, but the spirit living inside""",Portugal
Technical University of Cluj-Napoca,Paradoxul ingineriei: pune teoria în practică,Romanian,The paradox of engineering: It puts the theory into practice,The paradox of engineering: It puts the theory into practice,Portugal
University of Bucharest,Virtute et sapientia,Latin,By virtue and wisdom,By virtue and wisdom,Portugal
Lomonosov Moscow State University,"Наука есть ясное познание истины, просвещение разума",Russian,Science is the clear learning of truth and enlightenment of the mind,Science is the clear learning of truth and enlightenment of the mind,Romania
Moscow Institute of Physics and Technology,Sapere aude[15],Latin,Dare to know; Dare to be wise,Dare to know; Dare to be wise,Romania
Peoples' Friendship University of Russia,Scientia unescamus[16],Latin,We unite with knowledge,We unite with knowledge,Romania
St. Petersburg State University,Hic tuta perennat,Latin,Here we stay in peace,Here we stay in peace,Romania
State University – Higher School of Economics,Non scolae sed vitae discimus,Latin,"We do not learn for the school, but for life","We do not learn for the school, but for life",Romania
European University at Saint Petersburg,Addo Optimus Una,Latin,Bringing the best together,Bringing the best together,Romania
Orenburg State Institute of Management (OSIM),,Latin,Our students do us proud,Our students do us proud,Romania
National University of Rwanda,Illuminatio et Salus Populi[citation needed],Latin,Light and Salvation of the People,Light and Salvation of the People,Russia
National University of Singapore,Towards a Global Knowledge Enterprise,English,NA,Towards a Global Knowledge Enterprise,Rwanda
University of Sri Jayewardenepura,Vijja Uppaththang Settah[17],Sanskrit,Science is the Greatest of that which is born.,Science is the Greatest of that which is born.,Singapore
University of Peradeniya,Sarvasva Locanam Sasthram',Sanskrit,Supreme.,Supreme.,Sri_Lanka
"North-West University, Potchefstroom",In U Lig[18],Afrikaans,In Thy Light,In Thy Light,South_Africa
Rhodes University,"Vis, virtus, veritas[19]",Latin,"Strength, courage, truth""","Strength, courage, truth""",South_Africa
Stellenbosch University,Pectora roborant cultus recti[20],Latin,Sound learning strengthens the spirit,Sound learning strengthens the spirit,South_Africa
University of Cape Town,Spes Bona[21],Latin,Good Hope,Good Hope,South_Africa
University of Fort Hare,In lumine tuo videbimus lumen[22],Latin,In Thy light we see light,In Thy light we see light,South_Africa
University of the Free State,In Veritate Sapientiae Lux [23],Latin,In Truth is the Light of Wisdom,In Truth is the Light of Wisdom,South_Africa
University of Pretoria,Ad Destinatum Persequor[24],Latin,"I pursue destiny (lit. ""I pursue toward that which is resolved"")","I pursue destiny (lit. ""I pursue toward that which is resolved"")",South_Africa
University of South Africa,Pro Gentibus Sapientia[25],Latin,Learning in Service to Humanity,Learning in Service to Humanity,South_Africa
University of the Western Cape,Respice Prospice[26],Latin,"look to the future, learn from the past","look to the future, learn from the past",South_Africa
University of the Witwatersrand,Scientia et Labore[27],Latin,With knowledge and labor,With knowledge and labor,South_Africa
University of Venda,Knowledge is Precious [28],English,,Knowledge is Precious [28],South_Africa
University of Zululand,Diligentia Cresco[29],Latin,By Diligence we shall lead,By Diligence we shall lead,South_Africa
University of Khartoum,الله، الحقيقة، الوطن، الإنسانية,Arabic,God - Truth - Our Country - Humanity[121],God - Truth - Our Country - Humanity[121],Sudan
