University,Motto,Language,Translation,text,country
Mines Paris,Théorie et pratique,French,Theory and practice,Theory and practice,France
University of Paris,Hic et ubique terrarum,Latin,Here and anywhere on earth,Here and anywhere on earth,France
Chavagnes Studium,In electis tuis mitte radices,Latin,Put down roots in your elect,Put down roots in your elect,France
Centrale Paris,"Leader, Entrepreneur, Innovateur",French,"Leader, Entrepreneur, Innovator","Leader, Entrepreneur, Innovator",France
RWTH Aachen University,Zukunft denken,German,Thinking the Future,Thinking the Future,Germany
Free University of Berlin,Veritas - Iustitia - Libertas,Latin,Truth - Justice - Freedom,Truth - Justice - Freedom,Germany
University of Freiburg,Die Wahrheit wird euch frei machen,German,The truth will make you free (John 8:32),The truth will make you free (John 8:32),Germany
Darmstadt University of Technology,Mens agitat molem,Latin,Mind drives matter,Mind drives matter,Germany
University of Greifswald,Wissen lockt. Seit 1456.,German,Knowledge attracts. Since 1456.,Knowledge attracts. Since 1456.,Germany
Hannover Medical School,Unitas Libertas Caritas,Latin,Unity Liberty  Charity,Unity Liberty  Charity,Germany
University of Mainz,"Ut omnes unum sint
Dass alle eins seien","Latin, German",That they all may be one (John 17:21),That they all may be one (John 17:21),Germany
Ruprecht Karl University of Heidelberg,Semper apertus,Latin,Always open,Always open,Germany
University of Hamburg,"der Forschung, der Lehre, der Bildung",German,"for research, for teaching, for education","for research, for teaching, for education",Germany
University of Kiel,Pax optima rerum,Latin,Peace is the greatest good,Peace is the greatest good,Germany
Technische Universität Dresden,Wissen schafft Brücken.,German,Knowledge builds bridges.,Knowledge builds bridges.,Germany
University of Mannheim,In Omnibus Veritas,Latin,In All the Truth,In All the Truth,Germany
Technische Universität München,"Zuhause in Bayern, erfolgreich in der Welt. Die unternehmerische Universität.",German,"At home in Bavaria, successful in the world. The entrepreneurial University.","At home in Bavaria, successful in the world. The entrepreneurial University.",Germany
University of Potsdam,Klein aber fein,German,Small but excellent,Small but excellent,Germany
University of Rostock,Traditio et Innovatio,Latin,Tradition and innovation,Tradition and innovation,Germany
University of Göttingen,In publica commoda,Latin,For the good of all,For the good of all,Germany
University of Trier,Treveris ex urbe Deus complet dona sophiae,Latin,"In the city of Trier, God completes the gifts of wisdom","In the city of Trier, God completes the gifts of wisdom",Germany
University of Tübingen,Attempto!,Latin,I dare!,I dare!,Germany
Georgian Institute of Public Affairs,In hoc signo vinces,Latin,In this sign you will conquer,In this sign you will conquer,Georgia
Free University of Tbilisi,"Scientia, Labor, Libertas",Latin,"Knowledge, Labour, Freedom","Knowledge, Labour, Freedom",Georgia
Grigol Robakidze University,Scientia Et Veritas,Latin,Knowledge and Truth,Knowledge and Truth,Georgia
University of Ghana,Integri Procedamus[89],Latin,proceed with integrity,proceed with integrity,Ghana
University of Cape Coast,Veritas Nobis Lumen[90],Latin,"Truth, Our guide.[90]","Truth, Our guide.[90]",Ghana
Kwame Nkrumah University of Science and Technology,Nyansapɔ wɔsane no badwenma[91],Twi,The knot of Wisdom is untied only by the wise[91],The knot of Wisdom is untied only by the wise[91],Ghana
"University of Education, Winneba",Education for service[citation needed],English,,Education for service[citation needed],Ghana
Zenith University College,Per Ardua Ad Astra[citation needed],Latin,"Through Adversity to the Stars - in effect, Through Hard Work to the Top","Through Adversity to the Stars - in effect, Through Hard Work to the Top",Ghana
University for Development Studies,Knowledge for Service[92],English,,Knowledge for Service[92],Ghana
University of Mines and Technology,"knowledge, truth and excellence[93]",English,,"knowledge, truth and excellence[93]",Ghana
The University of Hong Kong,Sapientia et Virtus/明徳格物[94],Latin/Classical Chinese,Wisdom and virtue[94]/To disseminate virtue and to investigate the way of things,Wisdom and virtue[94]/To disseminate virtue and to investigate the way of things,Hong_Kong
The Chinese University of Hong Kong,博文約禮[95],Classical Chinese,Through learning and temperance to virtue[95],Through learning and temperance to virtue[95],Hong_Kong
The Hong Kong University of Science and Technology,(no official motto)[96],,,,Hong_Kong
City University of Hong Kong,敬業樂群/Officium et Civitas[97],Chinese/Latin,"respect one's professional knowledge, deal with others cheerfully and harmoniously[97]","respect one's professional knowledge, deal with others cheerfully and harmoniously[97]",Hong_Kong
Hong Kong Polytechnic University,開物成務 勵學利民[98],Chinese,"To learn and to apply, for the benefit of mankind[99]","To learn and to apply, for the benefit of mankind[99]",Hong_Kong
Hong Kong Baptist University,篤信力行Light and truth[100],Classical Chinese,to have faith and proceed with perseverance[100],to have faith and proceed with perseverance[100],Hong_Kong
Lingnan University,作育英才，服務社會[101],Chinese,Education for Service[102],Education for Service[102],Hong_Kong
University of Pécs,Magyarország első egyeteme,Hungarian,The first University of Hungary.,The first University of Hungary.,Hungary
University of Szeged,Veritas. Virtus. Libertas.,Latin,Truth. Courage. Freedom.,Truth. Courage. Freedom.,Hungary
Eötvös Loránd University,A tudás közössége,Hungarian,The community of knowledge.,The community of knowledge.,Hungary
Corvinus University,Scientia mea - adiutor meus,Latin,My knowledge is my helper.,My knowledge is my helper.,Hungary
Ranchi University,"May nostrum scientia fio splendens/
तेजस्वि नावधीतमस्तु","Latin/
Sanskrit",May our knowledge become brilliant,May our knowledge become brilliant,India
Indian Institute of Technology Madras,सिद्धिर्भवति कर्मजा siddhirbhavati karmaja,Sanskrit,Effort Yields Success,Effort Yields Success,India
Indian Institute of Technology Kharagpur,योगः कर्मसु कौशलम्,Sanskrit,Excellence in work is (true) yoga,Excellence in work is (true) yoga,India
Indian Institute of Technology Kanpur,तमसो मा ज्योतिर्गमय (tamaso mā jyotirgamaya),Sanskrit,Lead me from darkness to light,Lead me from darkness to light,India
Indian Institute of Technology Guwahati,Knowledge Is Power,Sanskrit,Knowledge Is Power,Knowledge Is Power,India
Indian Institute of Technology Bombay,ज्ञानं परमं ध्येयम्(jñānaṁ paramaṁ dhyeyam),Sanskrit,Knowledge is the Supreme Goal,Knowledge is the Supreme Goal,India
Indian Institute of Technology Roorkee,śramam vinā na kimapi sādhyam / श्रमम् विना न किमपि साध्यम् / shramam vinA na kimapi sAdhyam,Sanskrit,without effort nothing is possible,without effort nothing is possible,India
Indian Institute of Management Ahmedabad,vidyā viniyogāt vikāsaḥ / विद्या विनियोगात् विकासः / vidyA viniyogAt vikAsaH,Sanskrit,progress comes from proper application of knowledge,progress comes from proper application of knowledge,India
Indian Institute of Management Tiruchirappalli,ज्ञानम् अनंतम्,Sanskrit,Knowledge is Endless,Knowledge is Endless,India
Indian Institute of Management Kozhikode,yogaḥ karmasu kauśalam / योगः कर्मसु कौशलम् / yogaH karmasu kaushalam,Sanskrit,excellence in action is yoga,excellence in action is yoga,India
Indian Institute of Information Technology and Management Gwalior,viśvajīvanāmṛtam jñānam / विश्वजीवनामृतम् ज्ञानम् / vishvajeevanAmRRitam GYaanam,Sanskrit,Knowledge is the nectar of Life,Knowledge is the nectar of Life,India
Indian Statistical Institute,bhinneṣvaikyasya darśanam / भिन्नेष्वैक्यस्य दर्शनम् / bhinneShvaikyasya darshanam,Sanskrit,"even in differences, see the unity","even in differences, see the unity",India
Acharya Nagarjuna University,satye sarvaṃ pratiṣṭhitam / सत्ये सर्वं प्रतिष्ठितम् / satye sarvaM pratiShThitam,Sanskrit,Everything is established in truth,Everything is established in truth,India
All India Institute of Medical Sciences,śarīramādyaṃ khalu dharmasādhanam / शरीरमाद्यं खलु धर्मसाधनम् / shareeramAdyaM khalu dharmasAdhanam,Sanskrit,Body alone is the instrument of doing all duties/deeds,Body alone is the instrument of doing all duties/deeds,India
Amrita Vishwa Vidyapeetham,śraddhāvān labhate jñānam / श्रद्धावान् लभते ज्ञानम् / shraddhAvAn labhate GYaanam,Sanskrit,"Reverent attains wisdom, (from Rigveda)","Reverent attains wisdom, (from Rigveda)",India
Andhra University,tejasvi nāvadhītamastu / तेजस्वि नावधीतमस्तु / tejasvi naavadhiitamastu,Sanskrit,May our knowledge become brilliant,May our knowledge become brilliant,India
Veer Bahadur Singh Purvanchal University,tejasvi nāvadhītamastu / तेजस्वि नावधीतमस्तु / tejasvi naavadhiitamastu,Sanskrit,May our knowledge become brilliant,May our knowledge become brilliant,India
Banaras Hindu University,vidyayā amṛtaṃ aśnute / विद्ययाऽमृतमश्नुते / vidyayA amRRitaM ashnute,Sanskrit,be immortal through knowledge,be immortal through knowledge,India
Banasthali Vidyapith,sā vidyā yā vimuktaye / सा विद्या या विमुक्तये / sA vidyA yA vimuktaye,Sanskrit,That is knowledge which liberates,That is knowledge which liberates,India
"Bengal Engineering and Science University, Shibpur",uttiṣṭha jāgrata prāpya varānnibodhata / उत्तिष्ठ जाग्रत प्राप्य वरान्निबोधत / uttiShTha jAgrata prApya varAnnibodhata,Sanskrit,"arise, awake, obtaining worthy (teachers), know (the truth)","arise, awake, obtaining worthy (teachers), know (the truth)",India
"Birla Institute of Technology, Mesra, Ranchi",sā vidyā yā vimuktaye / सा विद्या या विमुक्तये / sA vidyA yA vimuktaye,Sanskrit,That is knowledge which liberates,That is knowledge which liberates,India
"Birla Institute of Technology and Science, Pilani",jñānaṃ paramaṃ balam / ज्ञानं परमं बलम् / GYaanaM paramaM balam,Sanskrit,knowledge is the supreme power,knowledge is the supreme power,India
Central Board of Secondary Education,asato mā sadgamaya / असतो मा सद्गमय / asato mA sadgamaya,Sanskrit,Lead us From Untruth to Truth,Lead us From Untruth to Truth,India
Chaitanya Bharathi Institute of Technology,swayam tejaswin bhava,Sanskrit,Be self-enlightened,Be self-enlightened,India
Cochin University of Science and Technology,tejasvi nāvadhītamastu / तेजस्वि नावधीतमस्तु / tejasvi naavadhiitamastu,Sanskrit,May our knowledge become brilliant,May our knowledge become brilliant,India
"College of Engineering, Trivandrum",karma jyayoghya karmanah,Sanskrit,NA,NA,India
Devi Ahilya Vishwavidyalaya,dhiyo yo naḥ pracodayāt / धियो यो नः प्रचोदयात् / dhiyo yo naH prachodayaat,Sanskrit,may (the divine power) propel our intellect,may (the divine power) propel our intellect,India
University of Mumbai,शीलष्टतफला विद्या,Sanskrit,The Fruit of Learning is Character and Righteous Conduct.,The Fruit of Learning is Character and Righteous Conduct.,India
University of Delhi,निष्ठा धृति: सत्यम,Sanskrit,Dedicated to the Truth,Dedicated to the Truth,India
University of Pune,य: क्रियावान् स पण्डितः,Sanskrit,He who is industrious is learned,He who is industrious is learned,India
University of Calcutta,Advancement of Learning,English,NA,Advancement of Learning,India
Visva Bharati University,Yatra visvam bhavatyekanidam,Sanskrit,Where the world makes a home in a single nest,Where the world makes a home in a single nest,India
Gujarat National Law University,ā no bhadrāḥ kratavo yantu viśvataḥ  / आ नो भद्राः क्रतवो यन्तु विश्वतः / A no bhadraaH kratavo yantu vishvataH {from -(1.89.1 rigveda)},Sanskrit,"Let good (thoughts) come from everywhere, from all the world","Let good (thoughts) come from everywhere, from all the world",India
Guru Gobind Singh Indraprastha University,ज्योतिवृ्णीत तमसो विजानऩ /jyotivranit tamso vijajnam,Sanskrit,Cleave the darkness and light through knowledge.,Cleave the darkness and light through knowledge.,India
Kurukshetra University,yogastha kuru karmāṇi / योगस्थ कुरु कर्माणि / yogastha kuru karmANi,Sanskrit,do while steadfast in yoga,do while steadfast in yoga,India
"Madan Mohan Malaviya Engineering College, Gorakhpur",yogaḥ karmasu kauśalam / योगः कर्मसु कौशलम् / yogaH karmasu kaushalam,Sanskrit,excellence in action is yoga,excellence in action is yoga,India
The Maharaja Sayajirao University of Baroda,satyaṃ śivaṃ sundaram / सत्यं शिवं सुन्दरम् / satyaM shivaM sundaram,Sanskrit,"truth, auspiciousness, beauty","truth, auspiciousness, beauty",India
Manipal University,pragyānam brahm / प्रज्ञानं ब्रह्म / pragyānam brahm,Sanskrit,Knowledge is the attainment of God,Knowledge is the attainment of God,India
Motilal Nehru National Institute of Technology,siddhirbhavati karmajā / सिद्धिर्भवति कर्मजा / siddhirbhavati karmajA,Sanskrit,success is born of action,success is born of action,India
"National Institute of Technology, Durgapur",udyogah purushasya lakshanam / उद्योगः पुरुषस्य लक्षणं / udyogah purushasya lakshanam,Sanskrit,industry is man's objective,industry is man's objective,India
"National Institute of Technology, Hamirpur",Udyamena hi siddhayānti kāryāṇi na manorathaiḥ / उद्यमेन हि सिद्धयान्ति कार्याणि न मनोरथैः,Sanskrit,"A goal is achieved through labor, not by desire only","A goal is achieved through labor, not by desire only",India
"National Institute of Technology, Kurukshetra",śramonavarata ceṣṭā ca / श्रमोनवरत चेष्टा च / shramonavarata cheShTA cha,Sanskrit,(tireless effort and attempt,(tireless effort and attempt,India
"National Institute of Technology,Raipur",नित्यं यातो शुभोदयं / Nityam Yato Shubhodayam,Sanskrit,Let the rise of goodness happen everyday,Let the rise of goodness happen everyday,India
"National Institute of Technology, Agartala",jñānaṃ paramaṃ balam / ज्ञानं परमं बलम् / GYaanaM paramaM balam,Sanskrit,knowledge is the supreme power,knowledge is the supreme power,India
Maulana Azad National Institute of Technology,vidha bharen bhooshanam,Sanskrit,,,India
National Institute of Technology Calicut,तमसो मा ज्योतिर्गमय (tamaso mā jyotir gamaya),Sanskrit,"From Darkness, Lead us unto Light","From Darkness, Lead us unto Light",India
Malaviya National Institute of Technology Jaipur,य़ॊगः कऱमसु कौशलम,Sanskrit,Diligence Leads to Excellence,Diligence Leads to Excellence,India
Dr. B. R. Ambedkar National Institute of Technology,सरस्वती नमस्तुभ्यम्,Sanskrit,I bow to mother saraswati (goddess saraswati).,I bow to mother saraswati (goddess saraswati).,India
"National Institute of Technology, Jamshedpur",शंन ॠभवः सुकृतः सुहस्ताः,Sanskrit,,,India
"National Institute of Technology, Patna",śramonavarata ceṣṭā ca / श्रमोनवरत चेष्टा च,Sanskrit,tireless effort and attempt,tireless effort and attempt,India
National Institute of Technology Raipur,नित्यं यातो शुभोदयं,Sanskrit,Let the rise of goodness happen everyday,Let the rise of goodness happen everyday,India
"National Institute of Technology, Silchar",tejasvi nāvadhītamastu / तेजस्वि नावधीतमस्तु,Sanskrit,May our knowledge become brilliant,May our knowledge become brilliant,India
"National Institute of Technology, Srinagar",الظلمات إلى النور /तमसो मा ज्योर्तिगमय,"Urdu, Sanskrit",Lead me from Darkness to Light,Lead me from Darkness to Light,India
"Sardar Vallabhbhai National Institute of Technology, Surat",विज्ञानम सारथि (Vigyanam Saarthi),Sanskrit,Charioteer(सारथि) of Science(विज्ञानम),Charioteer(सारथि) of Science(विज्ञानम),India
National Institute of Technology Karnataka,Kannada: ಕಾಯಕವೇ ಕೈಲಾಸ Sanskrit: तत्पूजा कर्मचाखिलम,"kannada, Sanskrit",Work is worship,Work is worship,India
"National Institute of Technology, Tiruchirappalli",सत्यमेव जयते,Sanskrit,Truth always wins,Truth always wins,India
"National Institute of Technology, Goa",या विद्या सा विमुक्तये,Sanskrit,True Knowledge Liberates,True Knowledge Liberates,India
VIT University,A place to learn; A chance to grow,English,A place to learn; A chance to grow,A place to learn; A chance to grow,India
Anna University,Progress through knowledge,English,Progress through knowledge,Progress through knowledge,India
"Loyola College, Chennai",Luceat Lux Vestra,Latin,Let your Light Shine,Let your Light Shine,India
"Scottish Church College, Kolkata",Nec Tamen Consumebatur,Latin,"Burning, but yet not consumed","Burning, but yet not consumed",India
"St. Xavier's College, Kolkata",Nihil Ultra,Latin,Nothing Beyond,Nothing Beyond,India
"St. Stephen's College, Delhi",Ad Dei Gloriam,Latin,To the Glory of God,To the Glory of God,India
Madras Christian College,In Hoc Signo,Latin,"With this as your banner, you shall prevail","With this as your banner, you shall prevail",India
"Presidency College, Chennai",unde orta recurrent,Latin,whence it arose back,whence it arose back,India
"Fergusson College, Pune","Knowledge is Power
DES:Union is strength",English,,"Knowledge is Power
DES:Union is strength",India
"Christ University, Bangalore",Excellence and Service,English,Excellence and Service,Excellence and Service,India
Netaji Subhas Institute of Technology,ā no bhadrāḥ kratavo yantu viśvataḥ / आ नो भद्राः क्रतवो यन्तु विश्वतः / A no bhadraaH kratavo yantu vishvataH [from (1.89.1 rigveda)],Sanskrit,"Let good (thoughts) come from everywhere, from all the world","Let good (thoughts) come from everywhere, from all the world",India
Osmania University,tamaso mā jyotirgamaya / तमसो मा ज्योतिर्गमय / tamaso mA jyotirgamaya,Sanskrit,Lead us from Darkness to Light,Lead us from Darkness to Light,India
National Law School of India University,dharmo rakṣati rakṣitaḥ / धर्मो रक्षति रक्षितः / dharmo rakShati rakShitaH,Sanskrit,values protect the protector (of values),values protect the protector (of values),India
Sampurnanand Sanskrit University,Sśrutam me gopāya / श्रुतम् मे गोपाय / shrutam me gopaaya,Sanskrit,"let my learning be safe, i.e. let it be fruitful, let me not forget my learning","let my learning be safe, i.e. let it be fruitful, let me not forget my learning",India
Samrat Ashok Technological Institute,yogaḥ karmasu kauśalam / योगः कर्मसु कौशलम् / yogaH karmasu kaushalam,Sanskrit,excellence in action is yoga,excellence in action is yoga,India
Sri Venkateswara University,Jnānam Samyaga Vekshanam,Sanskrit,Wisdom lies in proper perspective,Wisdom lies in proper perspective,India
Tilka Manjhi Bhagalpur University,tamaso mā jyotirgamaya / तमसो मा ज्योतिर्गमय / tamaso mA jyotirgamaya,Sanskrit,Lead us from Darkness to Light,Lead us from Darkness to Light,India
University of Calicut,Nirmaya Karmana Sree,Sanskrit,Prosperity will be produced by pure action,Prosperity will be produced by pure action,India
University of Hyderabad,Sa Vidhya Ya Vimukthaye,Sanskrit,Education results in liberation,Education results in liberation,India
University of Kerala,Karmani Vyajyate Prajna,Sanskrit,One's intellect is revealed through one's actions,One's intellect is revealed through one's actions,India
University of Mysore,"Nahi Jnanena Sadrusham,  Sathyamevoddharamyaham,",Sanskrit,"Nothing is Equal to Knowledge,   I uphold only the truth","Nothing is Equal to Knowledge,   I uphold only the truth",India
University of Rajasthan,Dharmo Vishwasya Jagatah Pratishtha,Sanskrit,Dharma is the firm foundation upon which the entire universe stands,Dharma is the firm foundation upon which the entire universe stands,India
Uttar Pradesh Technical University,yogaḥ karmasu kauśalam / योगः कर्मसु कौशलम् / yogaH karmasu kaushalam,Sanskrit,excellence in action is yoga,excellence in action is yoga,India
"Visvesvaraya National Institute of Technology Nagpur,",yogaḥ karmasu kauśalam / योगः कर्मसु कौशलम् / yogaH karmasu kaushalam,Sanskrit,excellence in action is yoga,excellence in action is yoga,India
West Bengal National University of Juridical Sciences,Yuktiheena Vicharetu Dharmahnih Prajayate,Sanskrit,Judgement Devoid Of Logic Destroys Dharma,Judgement Devoid Of Logic Destroys Dharma,India
Visvesvaraya Technological University,Modalu mānavanāgu,Kannada,"Above all, be human","Above all, be human",India
University of Allahabad,Quot Rami Tot Arbores,Latin,as many Branches so many Trees,as many Branches so many Trees,India
"Faculty of Psychology and Socio-Cultural Sciences, Universitas Islam Indonesia",Committed to Knowledge,English,,Committed to Knowledge,Indonesia
Institut Pertanian Bogor,Searching and Serving The Best,English,,Searching and Serving The Best,Indonesia
Institut Teknologi Bandung,In Harmonia Progressio,Latin,Progress in Harmony,Progress in Harmony,Indonesia
Institut Teknologi Sepuluh Nopember,Cerdas Ulet Kreatif,Bahasa Indonesia,Intelligent Tough Creative,Intelligent Tough Creative,Indonesia
Universitas Gadjah Mada,"Locally rooted, globally respected",English,,"Locally rooted, globally respected",Indonesia
Universitas Indonesia,Veritas Probitas Iustitia,Latin,"Truth, honesty, Justice","Truth, honesty, Justice",Indonesia
Universitas Islam Indonesia,Values. Innovation. Perfection.,English,,Values. Innovation. Perfection.,Indonesia
Universitas Islam Negeri Syarif Hidayatullah Jakarta,Knowledge Piety Integrity,English,,Knowledge Piety Integrity,Indonesia
Universitas Pendidikan Indonesia,Leading and Understanding,English,,Leading and Understanding,Indonesia
Universitas Sanata Dharma Yogyarta,Ad Maiorem Dei Gloriam,Latin,to the greater glory of God,to the greater glory of God,Indonesia
Universitas Kristen Indonesia,"Melayani, bukan Dilayani",Bahasa Indonesia,"To serve, not to be served (Matthew 20:28, Mark 10:45)","To serve, not to be served (Matthew 20:28, Mark 10:45)",Indonesia
Universitas HKBP Nommensen,Pro Deo et Patria,Latin,For God and Country,For God and Country,Indonesia
Nommensen HKBP University,Bagi Tuhan dan Ibu Pertiwi,Bahasa Indonesia,NA,NA,Indonesia
Universitas Muhammadiyah Yogyakarta,Unggul dan Islami,Bahasa Indonesia,Eminent and Islamic,Eminent and Islamic,Indonesia
Universitas Sriwijaya,Ilmu Alat Pengabdian,Bahasa Indonesia,Science as Dedication Services,Science as Dedication Services,Indonesia
Dublin City University,Ireland's University of Enterprise,English,,Ireland's University of Enterprise,Ireland
Maynooth University,Veritati Fir Fer,Latin,Truth Strength Courage,Truth Strength Courage,Ireland
NUI Galway,Deo favente,Latin,With the favour of God,With the favour of God,Ireland
University College Cork,"Where Finbarr taught, let Munster learn",English,,"Where Finbarr taught, let Munster learn",Ireland
University College Dublin,Ad Astra,Latin,To the stars,To the stars,Ireland
University of Limerick,Wisdom for action,English,,Wisdom for action,Ireland
University of Tehran,میاسای ز آموختن یک زمان,Persian,Rest not a moment from learning,Rest not a moment from learning,Iran
Tehran university of medical sciences,,English,Caring for a New Generation,,Iran
Iran University of Science and Technology,هیچ چیز غیرممکن نیست,Persian,Nothing is Impossible,Nothing is Impossible,Iran
Alzahra University,زنان آگاه جامعه پیشرفته,Persian,"Learned Woman, Progressive Society","Learned Woman, Progressive Society",Iran
Kharazmi University,آموختن برای زندگی بهتر,Persian,Learning for A Better Life,Learning for A Better Life,Iran
Pontifical Gregorian University,Religioni et Bonis Artibus,Latin,For Religion and Culture,For Religion and Culture,Italy
Sapienza University of Rome,Il futuro è passato qui,Italian,In here the future is already become past / The future has been here / The future has stopped by here,In here the future is already become past / The future has been here / The future has stopped by here,Italy
