University,Motto,Language,Translation,text,country
University of Buenos Aires,Argentum virtus robur et studium,Latin,Argentine virtue is strength and study,Argentine virtue is strength and study,Argentina
Buenos Aires Institute of Technology,Ad Lucem Serenitate Tendo,Latin,To the light peacefully I go,To the light peacefully I go,Argentina
National University of Córdoba,Ut portet nomen meum coram gentibus,Latin,Carry my name to the people,Carry my name to the people,Argentina
National University of the South,Ardua Veritatem,Latin,Through the difficulties to the truth,Through the difficulties to the truth,Argentina
National University of Tucuman,Pedes in Terra ad Sidera Visus,Latin,Feet on the ground and sight to the universe,Feet on the ground and sight to the universe,Argentina
Australian Catholic University,Truth in Love,English,,Truth in Love,Australia
Australian National University,Naturam Primum Cognoscere Rerum,Latin,"First, [let him busy himself] to learn the nature of things. From Lucretius, De Rerum Natura, l. VI.","First, [let him busy himself] to learn the nature of things. From Lucretius, De Rerum Natura, l. VI.",Australia
Bond University,Bringing Ambition To Life,English,,Bringing Ambition To Life,Australia
Central Queensland University,Doctrina Perpetua,Latin,Forever Learning,Forever Learning,Australia
Curtin University of Technology,Look Ever Forward,English,NA,Look Ever Forward,Australia
Deakin University,Worldly,English,,Worldly,Australia
Federation University Australia,Learn to Succeed,English,,Learn to Succeed,Australia
Flinders University,Inspiring Achievement,English,,Inspiring Achievement,Australia
Griffith University,Know More. Do More.,English,,Know More. Do More.,Australia
James Cook University,Crescente Luce,Italian,Light ever increasing,Light ever increasing,Australia
La Trobe University,Qui cherche trouve,French,"Whoever seeks, finds. (Matthew 7:7)","Whoever seeks, finds. (Matthew 7:7)",Australia
Macquarie University,And Gladly Teche,Middle English,And gladly teach — from The Canterbury Tales,And gladly teach — from The Canterbury Tales,Australia
Monash University,Ancora imparo,Italian,I am still learning - Michelangelo.,I am still learning - Michelangelo.,Australia
Queensland University of Technology,A university for the real world,English,,A university for the real world,Australia
Royal Melbourne Institute of Technology,Perita manus mens exculta,Latin,[a] Skilled hand [and] cultivated mind,[a] Skilled hand [and] cultivated mind,Australia
Swinburne University of Technology,Factum per Litteras,Latin,Achievement through learning,Achievement through learning,Australia
University of Adelaide,Sub Cruce Lumen,Latin,The light [of learning] under the [Southern] Cross,The light [of learning] under the [Southern] Cross,Australia
University of Canberra,New Intelligence,English,,New Intelligence,Australia
The University of Melbourne,Postera Crescam Laude,Latin,"We grow in the esteem of future generations. (""I will grow in praise afterwards."") - Horace, Odes, l. III. 30.","We grow in the esteem of future generations. (""I will grow in praise afterwards."") - Horace, Odes, l. III. 30.",Australia
University of New England,Ex sapientia modus,Latin,Out Of Wisdom Comes Moderation,Out Of Wisdom Comes Moderation,Australia
University of New South Wales,Scientia Manu et Mente,Latin,Knowledge by Hand and Mind,Knowledge by Hand and Mind,Australia
University of Newcastle,I Look Ahead,English,,I Look Ahead,Australia
The University of Notre Dame Australia,In principio erat Verbum,Latin,In the beginning was the Word. [John 1:1],In the beginning was the Word. [John 1:1],Australia
University of Queensland,Scientia ac Labore,Latin,Through knowledge and hard work,Through knowledge and hard work,Australia
University of Southern Queensland,Per Studia Mens Nova,Latin,Through study the mind is made new,Through study the mind is made new,Australia
University of Sydney,Sidere mens eadem mutato,Latin,"The constellations change, [but] the mind [remains] the same[1]","The constellations change, [but] the mind [remains] the same[1]",Australia
University of Tasmania,Ingeniis Patuit Campus,Latin,The field is open to talent,The field is open to talent,Australia
"University of Technology, Sydney",Think. Change. Do,English,,Think. Change. Do,Australia
"Victoria University, Melbourne",,,,,Australia
University of Western Australia,Seek Wisdom,English,,Seek Wisdom,Australia
Western Sydney University,Unlimited,English,,Unlimited,Australia
The College of The Bahamas,"Knowledge, Truth, Integrity[2]",English,NA,"Knowledge, Truth, Integrity[2]",Bahamas
Bangladesh University of Engineering and Technology,The Ocean of Knowledge,English,,The Ocean of Knowledge,Bangladesh
BRAC University,Inspiring Excellence,English,,Inspiring Excellence,Bangladesh
University of Dhaka,সত্যের জয় সুনিশ্চিত,Bangla,Truth Shall Prevail,Truth Shall Prevail,Bangladesh
Université Libre de Bruxelles,Scientia vincere tenebras,Latin,Conquering darkness by science,Conquering darkness by science,Belgium
Vrije Universiteit Brussel,Scientia vincere tenebras,Latin,Conquering darkness by science,Conquering darkness by science,Belgium
Université catholique de Louvain,Sedes sapientiae,Latin,Seat of wisdom,Seat of wisdom,Belgium
Katholieke Universiteit Leuven,Sedes sapientiae,Latin,Seat of wisdom,Seat of wisdom,Belgium
Ghent University,Inter Utrumque,Latin,In Between Both Extremes,In Between Both Extremes,Belgium
University of Hasselt,Knowledge in Action,English,,Knowledge in Action,Belgium
University of Botswana,Thuto Ke Thebe[3],Setswana,Education is a Shield[3],Education is a Shield[3],Botswana
Universidade de São Paulo,Scientia Vinces,Latin,Through knowledge you win,Through knowledge you win,Brazil
Federal University of Rio de Janeiro,A Universidade do Brasil,Portuguese,The University of Brazil,The University of Brazil,Brazil
Pontifícia Universidade Católica de Campinas,Fide Splendet et Scientia,Latin,May it shine with truth and knowledge,May it shine with truth and knowledge,Brazil
Pontifícia Universidade Católica do Rio de Janeiro,Alis grave nil,Latin,Nothing is too heavy for those who have wings,Nothing is too heavy for those who have wings,Brazil
Pontifícia Universidade Católica do Rio Grande do Sul,Ad verum ducit,Latin,Leading to the truth,Leading to the truth,Brazil
Universidade de Brasília,,,,,Brazil
Universidade Federal Fluminense,"Discere, docere, seminare",Latin,"Learn, teach, spread","Learn, teach, spread",Brazil
Universidade Federal de Minas Gerais,Incipit Vita Nova,Latin,A new life begins,A new life begins,Brazil
Universidade Federal de Uberlândia,Um bem público a serviço do Brasil,Portuguese,A public good in the service of Brazil,A public good in the service of Brazil,Brazil
Universidade Presbiteriana Mackenzie,Tradição e Pioneirismo na Educação,Portuguese,Tradition and pioneering in Education,Tradition and pioneering in Education,Brazil
Universidade Federal dos Vales do Jequitinhonha e Mucuri,Sapientia et Libertas,Latin,Wisdom and Freedom,Wisdom and Freedom,Brazil
Universidade Estadual do Ceará,Lumen Ad Viem,Latin,Enlightening life,Enlightening life,Brazil
Universidade Federal de Alagoas,Scientia ad Sapientiam,Latin,Knowledge for Wisdom,Knowledge for Wisdom,Brazil
Universidade Federal de Viçosa,"Ediscere, Scire, Agere, Vincere",Latin,"Study, Know, Act, Win","Study, Know, Act, Win",Brazil
Acadia University,In pulvere vinces,Latin,"In dust, you conquer","In dust, you conquer",Canada
Bishop's University,Recti cultus pectora roborant,Latin,Sound learning strengthens the spirit,Sound learning strengthens the spirit,Canada
Brandon University,Aletheuontes de en Agape,Greek,Speaking the truth in love,Speaking the truth in love,Canada
Brock University,Surgite!,Latin,Push on!,Push on!,Canada
Cape Breton University,Theid Dìchioll Air Thoiseach,Scottish Gaelic,Perseverance will Triumph,Perseverance will Triumph,Canada
Carleton University,Ours the Task Eternal,English,,Ours the Task Eternal,Canada
Concordia University,"Small planet, Big thinking",English,,"Small planet, Big thinking",Canada
Crandall University,Christus Praeeminens,Latin,Christ is preeminent,Christ is preeminent,Canada
Dalhousie University,Ora et Labora,Latin,Prayer and work,Prayer and work,Canada
École Polytechnique de Montréal,Ut tensio sic vis,Latin,"As the extension, the force","As the extension, the force",Canada
Kwantlen Polytechnic University,Through tireless effort knowledge and understanding,English,Through tireless effort knowledge and understanding,Through tireless effort knowledge and understanding,Canada
Lakehead University,Vos persolvo pro angustus obvius,Latin,Achievement through effort,Achievement through effort,Canada
Laurentian University,Emitte lucem et veritatem,Latin,Send forth thy light and thy truth,Send forth thy light and thy truth,Canada
McGill University,Grandescunt aucta labore,Latin,"By work, all things increase and grow","By work, all things increase and grow",Canada
McMaster University,Τα παντα εν Χριστωι συνεστηκεν,Greek,All things cohere in Christ,All things cohere in Christ,Canada
Memorial University of Newfoundland,Provehito in Altum,Latin,Launch forth into the deep,Launch forth into the deep,Canada
Mount Allison University,"Litterae, Religio, Scientia",Latin,"Writing, Divinity, Knowledge","Writing, Divinity, Knowledge",Canada
Mount Royal University,Quam Bene Non Quantum,Latin,"How well, not how much","How well, not how much",Canada
Mount Saint Vincent University,Veritas ad Deum ducit,Latin,Truth leads to God,Truth leads to God,Canada
Nipissing University,Integritas,Latin,Integrity,Integrity,Canada
Nova Scotia Agricultural College,Mens agitat molem,Latin,mind over matter,mind over matter,Canada
OCAD University,Imagination is Everything.,English,,Imagination is Everything.,Canada
Queen's University,Sapientia et Doctrina Stabilitas,Latin,Wisdom and knowledge shall be the stability of thy times,Wisdom and knowledge shall be the stability of thy times,Canada
Royal Military College of Canada,"Truth, Duty, Valour",English,"French: Vérité, Devoir, Vaillance","Truth, Duty, Valour",Canada
Royal Roads University,Life.Changing,English,,Life.Changing,Canada
Ryerson University,Mente et Artificio,Latin,With mind and hand,With mind and hand,Canada
Saint Francis Xavier University,Quaecumque Sunt Vera,Latin,Whatsoever things are true (Philippians 4:8),Whatsoever things are true (Philippians 4:8),Canada
Saint Mary's University,Age Quod Agis,Latin,"What you do, do well","What you do, do well",Canada
"St. Mary's University College, Calgary",In Lumine Tuo Videbimus Lumen,Latin,In Thy light shall we see light,In Thy light shall we see light,Canada
Simon Fraser University,Nous sommes prêts,French,We are ready,We are ready,Canada
St. Thomas University,Doce Bonitatem Scientiam et Disciplinam,Latin,Teach me Goodness and Knowledge and Discipline,Teach me Goodness and Knowledge and Discipline,Canada
Thompson Rivers University,Quansem Ilep,Secwepemc,To strive ahead,To strive ahead,Canada
Trent University,Nunc cognosco ex parte,Latin,Now I know in part,Now I know in part,Canada
Trinity Western University,Turris Fortis Deus Noster,Latin,A Mighty Fortress Is Our God,A Mighty Fortress Is Our God,Canada
Université de Montréal,Fide splendet et scientia,Latin,May it shine with truth and knowledge,May it shine with truth and knowledge,Canada
Université Laval,Deo favente haud pluribus impar,Latin,"By the grace of God, to no one equal","By the grace of God, to no one equal",Canada
University of Alberta,Quaecumque Vera,Latin,Whatsoever things are true,Whatsoever things are true,Canada
University of British Columbia,Tuum est,Latin,It's up to you or It is yours,It's up to you or It is yours,Canada
University of Calgary,Mo Shùile Togam Suas,Scottish Gaelic,I will lift up my eyes,I will lift up my eyes,Canada
University of Guelph,Rerum cognoscere causas,Latin,To learn the reasons of realities,To learn the reasons of realities,Canada
University of King's College,Deo Legi Regi Gregi,Latin,"For God, Law, King, People","For God, Law, King, People",Canada
University of Lethbridge,Fiat Lux,Latin,Let there be light,Let there be light,Canada
University of Manitoba,Floreat,Latin,"""Flourish"" or ""Prosper""","""Flourish"" or ""Prosper""",Canada
University of New Brunswick,Sapere Aude,Latin,Dare to know / Dare to be wise,Dare to know / Dare to be wise,Canada
University of Northern British Columbia,En Cha Huná,Dakelh language,"literally 'He/she too lives"", figuratively ""Other people have their point of view"")","literally 'He/she too lives"", figuratively ""Other people have their point of view"")",Canada
University of Ontario Institute of Technology,Cogitando et Agendo Ducemus,Latin,"By thinking and doing, we shall lead","By thinking and doing, we shall lead",Canada
University of Ottawa,Deus Scientiarum Dominus Est,Latin,God is the Master of Sciences,God is the Master of Sciences,Canada
University of Prince Edward Island,"Faith, Knowledge, Service",English,,"Faith, Knowledge, Service",Canada
University of Regina,As One Who Serves,English,,As One Who Serves,Canada
University of Saskatchewan,Deo et Patriae,Latin,For God and Country,For God and Country,Canada
Université de Sherbrooke,Veritatem in charitate,Latin,Truth in charity,Truth in charity,Canada
University of Toronto,Velut arbor ævo,Latin,As a Tree Through the Ages,As a Tree Through the Ages,Canada
University of Victoria,יהי אור y'hi or Multitudo sapientium sanitas orbis,HebrewLatin,Let there be lightA multitude of the wise is the health of the world,Let there be lightA multitude of the wise is the health of the world,Canada
University of Waterloo,Concordia cum veritate,Latin,In harmony with truth,In harmony with truth,Canada
University of Western Ontario,Veritas et Utilitas,Latin,Truth and usefulness,Truth and usefulness,Canada
University of Windsor,"Bonitatem, disciplinam, scientiam",Latin,"Goodness, discipline, knowledge","Goodness, discipline, knowledge",Canada
University of Winnipeg,Lux et Veritas Floreant,Latin,Let Light and Truth Flourish,Let Light and Truth Flourish,Canada
Wilfrid Laurier University,Veritas Omnia Vincit,Latin,Truth conquers all,Truth conquers all,Canada
York University,Tentanda via,Latin,The way must be tried,The way must be tried,Canada
Pontifical Catholic University of Chile,In Christi Lumine pro Mundi Vita,Latin,In Christ's light for the world's life,In Christ's light for the world's life,Chile
Pontifical Catholic University of Valparaíso,Fides et Labor,Latin,Faith and work,Faith and work,Chile
Federico Santa María Technical University,Ex Umbra in Solem,Latin,From the shadow into the sun,From the shadow into the sun,Chile
Metropolitan University of Educational Sciences,Veritas Humanitatis Lux,Latin,Truth is the light of mankind,Truth is the light of mankind,Chile
"University of Santiago, Chile",Labor Lætitia Nostra,Latin,Work is our joy,Work is our joy,Chile
Austral University of Chile,Libertas Capitur,Latin,Freedom is conquered,Freedom is conquered,Chile
Beijing Foreign Studies University,兼容并蓄 博学笃行[4],Chinese,,,China
Beijing Normal University,学为人师 行为世范[5],Chinese,"Learn, so as to instruct others; Act, to serve as example to all.[6]","Learn, so as to instruct others; Act, to serve as example to all.[6]",China
Beijing University of Posts and Telecommunications,厚德 博学 敬业 乐群[7],Chinese,"Great Virtue, Profound Knowledge, Total Commitment, Harmonious Cooperation[8]","Great Virtue, Profound Knowledge, Total Commitment, Harmonious Cooperation[8]",China
Beijing University of Technology,不息为体 日新为道[9],Chinese,"Taking persistence in pursuit as the substance, taking innovation everyday as the way[10]","Taking persistence in pursuit as the substance, taking innovation everyday as the way[10]",China
Chang'an University,弘毅明德 笃学创新[11],Chinese,,,China
China Pharmaceutical University,精业济群[12],Chinese,Be proficient and benefit others[13],Be proficient and benefit others[13],China
Chongqing University,耐劳苦、尚俭朴、勤学业、爱国家[14],Chinese,"Endure Toil, Cherish Thrift, Work Hard and Love the Country[15]","Endure Toil, Cherish Thrift, Work Hard and Love the Country[15]",China
Dalian University,文明 自强 求是 创新[16],Chinese,Civilization Self-Improvement Truth-Seeking and Originality[17],Civilization Self-Improvement Truth-Seeking and Originality[17],China
Fudan University,博学而笃志，切问而近思[18],Chinese,"Rich in knowledge and tenacious of purposes, inquiring with earnestness and reflecting with self-practice[19]","Rich in knowledge and tenacious of purposes, inquiring with earnestness and reflecting with self-practice[19]",China
Harbin Institute of Technology,规格严格 功夫到家[20],Chinese,,,China
Hebei University,实事求是，笃学诚行[21],Chinese,,,China
Heilongjiang University,参天尽物 博学慎思[22],Chinese,,,China
Henan University,明德，新民，至于至善[23],Chinese,To illustrate illustrious virtue; to renovate the people; and to rest in the highest excellence[24],To illustrate illustrious virtue; to renovate the people; and to rest in the highest excellence[24],China
Hohai University,艰苦朴素，实事求是，严格要求，勇于探索[25],Chinese,,,China
Huazhong University of Science and Technology,明德厚学，求是创新[26],Chinese,"Virtue, Knowledge, Truth, Originality[27]","Virtue, Knowledge, Truth, Originality[27]",China
Hunan University,实事求是 敢为人先[28],Chinese,Seeking Truth from Facts and Daring to be Pioneers[29],Seeking Truth from Facts and Daring to be Pioneers[29],China
Jiangsu University,博学 求是 明德[30],Chinese,"Be erudite, practical and virtuous[31]","Be erudite, practical and virtuous[31]",China
Jilin University,求实创新，励志图强[32],Chinese,"Objective and innovative, determination and persistence.","Objective and innovative, determination and persistence.",China
Jinan University,忠信笃敬[33],Chinese,"Loyalty, Sincerity, Integrity and Respect[34]","Loyalty, Sincerity, Integrity and Respect[34]",China
Lanzhou University,自强不息 独树一帜[35],Chinese,"Constantly Improving, Blazing Our Own Path[36]","Constantly Improving, Blazing Our Own Path[36]",China
Nanjing University,诚朴雄伟 励学敦行[37],Chinese,"Sincerity with Aspiration, Perseverance and Integrity[38]","Sincerity with Aspiration, Perseverance and Integrity[38]",China
Nankai University,允公允能，日新月异[39],Chinese,"Dedication to Public Interests, Acquisition of All-round Capability, Aspiration for Progress with Each Passing Day[39]","Dedication to Public Interests, Acquisition of All-round Capability, Aspiration for Progress with Each Passing Day[39]",China
Ningbo University,实事求是 经世致用[40],Chinese,Truth and pragmatism,Truth and pragmatism,China
Northeastern University,自强不息，知行合一[41],Chinese,,,China
Northwest University,公诚勤朴[42],Chinese,"justice, honesty, diligence, simple[43]","justice, honesty, diligence, simple[43]",China
Ocean University of China,海纳百川，取则行远[44],Chinese,Ocean Embraces Streams All and Exploring Promises Reaching Far[45],Ocean Embraces Streams All and Exploring Promises Reaching Far[45],China
Peking University,(No official motto)[46],,,,China
Qingdao University,博学笃志，明德求真，守正出奇[47],Chinese,,,China
Renmin University of China,实事求是[48],Chinese,Seeking truth from facts[49],Seeking truth from facts[49],China
Shandong University,学无止境 气有浩然[50],Chinese,Noble in Spirit; Boundless in Knowledge[51],Noble in Spirit; Boundless in Knowledge[51],China
Shanghai International Studies University,格高志远，学贯中外[52],Chinese,"Integrity, Vision and Academic Excellence[52]","Integrity, Vision and Academic Excellence[52]",China
Shanghai Jiao Tong University,饮水思源 爱国荣校[53],Chinese,"When you drink water, never shall you forget its source; love your motherland and add credit to your Alma Mater[54]","When you drink water, never shall you forget its source; love your motherland and add credit to your Alma Mater[54]",China
Shanghai University,自强不息；先天下之忧而忧，后天下之乐而乐[55],Chinese,"The movement of heaven is full of power. Thus the superior man makes himself strong and untiring.Be concerned about the affairs of state before others, and enjoy comfort after others.[56]","The movement of heaven is full of power. Thus the superior man makes himself strong and untiring.Be concerned about the affairs of state before others, and enjoy comfort after others.[56]",China
Shanxi University,尊广道艺、登崇俊良[57],Chinese,"being industrious, strict, honest and creative[58]","being industrious, strict, honest and creative[58]",China
Sichuan Normal University,重德，博学，务实，尚美[59],Chinese,,,China
Sichuan University,海纳百川 有容乃大[60],Chinese,"Sea encompasses hundreds of rivers, willingness to accept all is virtuous Officially: The ocean is exclusive because it embraces hundreds of rivers[61]","Sea encompasses hundreds of rivers, willingness to accept all is virtuous Officially: The ocean is exclusive because it embraces hundreds of rivers[61]",China
Soochow University,养天地正气，法古今完人[62],Chinese,Unto a full-grown man[63],Unto a full-grown man[63],China
Southeast University,止于至善[64],Chinese,Strive for Perfection[65],Strive for Perfection[65],China
Sun Yat-sen University,博学、审问、慎思、明辨、笃行[66],Chinese,"Study Extensively, Enquire Accurately, Reflect Carefully, Discriminate Clearly, Practise Earnestly[67]","Study Extensively, Enquire Accurately, Reflect Carefully, Discriminate Clearly, Practise Earnestly[67]",China
Tianjin University,实事求是[68],Chinese,Seeking Truth from Facts[69],Seeking Truth from Facts[69],China
Tianjin University of Technology,重德重能、求实求新[70],Chinese,"Focusing on Morals and Capability, Pursuing Truth and Innovation[71]","Focusing on Morals and Capability, Pursuing Truth and Innovation[71]",China
Tongji University,严谨、求实、团结、创新[72],Chinese,"Discipline, Practicality, Unity and Creativity[73]","Discipline, Practicality, Unity and Creativity[73]",China
Tsinghua University,自强不息、厚德载物[74],Chinese,Self-Discipline and Social Commitment[75],Self-Discipline and Social Commitment[75],China
University of Science and Technology of China,红专并进，理实交融[76],Chinese,"Being Both Politically Sound and Professionally Competent, and Integrating Theory with Practice[77]","Being Both Politically Sound and Professionally Competent, and Integrating Theory with Practice[77]",China
Wuhan University,自强 弘毅 求是 拓新[78],Chinese,"Improve Oneself, Promote Perseverance, Seek Truth and Make Innovations[79]","Improve Oneself, Promote Perseverance, Seek Truth and Make Innovations[79]",China
Xiamen University,自强不息 止于至善[80],Chinese,"Pursue Excellence, Strive for Perfection[81]","Pursue Excellence, Strive for Perfection[81]",China
Xiangtan University,博学笃行，盛德日新[82],Chinese,"Knowledge, Action and Virtue[83]","Knowledge, Action and Virtue[83]",China
Yantai University,守信 求实 好学 力行[84],Chinese,"Be trustworthy, be down-to-earth, be fond of learning, and practice earnestly[85]","Be trustworthy, be down-to-earth, be fond of learning, and practice earnestly[85]",China
Yunnan University,自尊 致知 正义 力行[86],Chinese,,,China
Zhejiang University,求是创新[87],Chinese,Seeking the Truth and Pioneering New Trails[88],Seeking the Truth and Pioneering New Trails[88],China
Autonomous University of Bucaramanga - UNAB,Liderazgo para el futuro,Spanish,Leadership for the future,Leadership for the future,Colombia
National University of Colombia,Inter Aulas Academiæ Quære Verum,Latin,Among the halls of the academy look for the truth,Among the halls of the academy look for the truth,Colombia
Pontifical Bolivarian University,Formación integral para la transformación social y humana,Spanish,Integral education for social and human transformation,Integral education for social and human transformation,Colombia
"Pontifical Bolivarian University, Bucaramanga Campus",Excelencia con sentido humano[citation needed],Spanish,Excellence with human sense,Excellence with human sense,Colombia
University of Los Andes (Colombia),Más Allá del Deber,Spanish,Beyond Duty,Beyond Duty,Colombia
Universidad de Costa Rica,Lucem aspicio,Latin,Towards light,Towards light,Costa_Rica
Aalborg University,Viis Novis,Latin,New ways,New ways,Denmark
University of Aarhus,Solidum petit in profundis,Latin,Seek a firm footing in the depths,Seek a firm footing in the depths,Denmark
University of Copenhagen,Coelestem adspicit lucem,Latin,It looks at the celestial light,It looks at the celestial light,Denmark
Universidad de Especialidades Espíritu Santo (UEES),Non progredi regredi est,Latin,"Not going forward, is going backwards","Not going forward, is going backwards",Ecuador
University of Fiji,"Affordability, Quality, Innovation, Creativity[citation needed]",English,NA,"Affordability, Quality, Innovation, Creativity[citation needed]",Fiji
University of Art and Design Helsinki,Pro Arte Utili,Latin,For useful abilities,For useful abilities,Finland
Helsinki University of Technology,Labor et scientia,Latin,Work and science,Work and science,Finland
University of Jyväskylä,Amica veritas,Latin,Truth is a friend,Truth is a friend,Finland
Ecole Polytechnique,"Pour la Patrie, les Sciences et la Gloire",French,"For the Homeland, Science and Glory","For the Homeland, Science and Glory",France
Académie de Bordeaux,Crescam et Lucebo,Latin,I shall grow and I shall shine,I shall grow and I shall shine,France
